{
 "authority": {
  "can_decide": false,
  "human_only_acceptance": true,
  "note": "This manifest creates review obligations only. It cannot approve, reject, lock, or decide a deck change.",
  "script_may_author_judgment": false
 },
 "dynamic_review_queues": {
  "high_optimizer_disagreement": {
   "entries": [],
   "required_fields": [
    "slug",
    "pass_a_hash",
    "pass_b_hash",
    "pass_a_challenger_hash",
    "pass_b_challenger_hash",
    "pass_a_swaps",
    "pass_b_swaps"
   ],
   "selector_function": "optimizer_disagreement_selection",
   "status": "awaiting_future_inputs"
  },
  "major_change": {
   "entries": [],
   "required_fields": [
    "slug",
    "total_swaps",
    "win_route_changed",
    "required_package_change_count",
    "mana_base_change_count"
   ],
   "selector_function": "major_change_selection",
   "status": "awaiting_future_inputs"
  }
 },
 "generated_by": "scripts/grixis_human_review_manifest.py v1",
 "limitations": [
  "Queue membership is not negative evidence about a deck.",
  "A pending queue item is not a failed review.",
  "Scripts may not fill strategic analysis or judgment fields on behalf of a reviewer.",
  "Dynamic queues stay empty until the pre-registered M6-stage inputs exist.",
  "Cory may require additional review beyond this minimum queue."
 ],
 "policy_sha256": "sha256:e230c9826f9501672db8d0fcc0288d93998db4b42921e38a966a77cd6b848895",
 "review_contract": {
  "actual_review_record_is_separate": true,
  "overlap_memberships_preserved": true,
  "sampling_is_minimum_not_maximum": true,
  "unsampled_is_not_certified": true
 },
 "sampling_manifest_sha256": "sha256:2f2b38d0f0752be816266bafa74096886281650715d43e8e3535126fa5d94aca",
 "schema_version": 1,
 "static_review_queue": [
  {
   "memberships": [
    "rules_sensitive"
   ],
   "review_id": "human-sample-v1:abaddon-the-despoiler",
   "review_requirement": {
    "allowed_methods": [
     "human",
     "agent_judgment"
    ],
    "requires_commander_first_context": true,
    "requires_evidence_classes": [
     "fact",
     "test_result",
     "strategic_judgment"
    ],
    "result_record": null,
    "script_may_author": false,
    "status": "pending"
   },
   "selection_inputs": {
    "rules_sensitive": {
     "construction_rule_count": 2,
     "exception_pending_bonus": 0,
     "key_interactions": 10,
     "non_verified_interactions": 3,
     "rules_risk_score": 21,
     "tie_hash": "3202da92ab0fe679b48124a0753d951f3f441895b97ec8491c5069b4605464fd"
    }
   },
   "slug": "abaddon-the-despoiler"
  },
  {
   "memberships": [
    "rules_sensitive"
   ],
   "review_id": "human-sample-v1:admiral-brass-unsinkable",
   "review_requirement": {
    "allowed_methods": [
     "human",
     "agent_judgment"
    ],
    "requires_commander_first_context": true,
    "requires_evidence_classes": [
     "fact",
     "test_result",
     "strategic_judgment"
    ],
    "result_record": null,
    "script_may_author": false,
    "status": "pending"
   },
   "selection_inputs": {
    "rules_sensitive": {
     "construction_rule_count": 2,
     "exception_pending_bonus": 0,
     "key_interactions": 3,
     "non_verified_interactions": 2,
     "rules_risk_score": 11,
     "tie_hash": "47152647826c8f0e258f99765b9eb2faaf1c28f207d2e9d6ba068086ebe34d14"
    }
   },
   "slug": "admiral-brass-unsinkable"
  },
  {
   "memberships": [
    "low_commander_dependence",
    "random"
   ],
   "review_id": "human-sample-v1:anhelo-the-painter",
   "review_requirement": {
    "allowed_methods": [
     "human",
     "agent_judgment"
    ],
    "requires_commander_first_context": true,
    "requires_evidence_classes": [
     "fact",
     "test_result",
     "strategic_judgment"
    ],
    "result_record": null,
    "script_may_author": false,
    "status": "pending"
   },
   "selection_inputs": {
    "low_commander_dependence": {
     "commander_linked_combo_fraction": 0.0,
     "explicit_commander_win_fraction": 0.25,
     "role": "significant",
     "role_rank": 1,
     "tie_hash": "e17aeba8777fd7b5d5a5657308805d6459a25b12c4f24a5200d256ff79bbd321"
    },
    "random": {
     "tie_hash": "1a3530c86aa8adae09e447f2080de802315e4df398dbc5aebe6178c91b0cbcbb"
    }
   },
   "slug": "anhelo-the-painter"
  },
  {
   "memberships": [
    "low_commander_dependence"
   ],
   "review_id": "human-sample-v1:ashad-the-lone-cyberman",
   "review_requirement": {
    "allowed_methods": [
     "human",
     "agent_judgment"
    ],
    "requires_commander_first_context": true,
    "requires_evidence_classes": [
     "fact",
     "test_result",
     "strategic_judgment"
    ],
    "result_record": null,
    "script_may_author": false,
    "status": "pending"
   },
   "selection_inputs": {
    "low_commander_dependence": {
     "commander_linked_combo_fraction": 0.0,
     "explicit_commander_win_fraction": 0.333333,
     "role": "significant",
     "role_rank": 1,
     "tie_hash": "076bdf0f7856c568f37720d39858ddf9378320ae93fa83e7bb65dbd353392cda"
    }
   },
   "slug": "ashad-the-lone-cyberman"
  },
  {
   "memberships": [
    "random",
    "rules_sensitive"
   ],
   "review_id": "human-sample-v1:ashnod-the-uncaring",
   "review_requirement": {
    "allowed_methods": [
     "human",
     "agent_judgment"
    ],
    "requires_commander_first_context": true,
    "requires_evidence_classes": [
     "fact",
     "test_result",
     "strategic_judgment"
    ],
    "result_record": null,
    "script_may_author": false,
    "status": "pending"
   },
   "selection_inputs": {
    "random": {
     "tie_hash": "1131df11b74536a0a5b569c9b7bcd92ad999986592d24dc440111c225a7a1c70"
    },
    "rules_sensitive": {
     "construction_rule_count": 2,
     "exception_pending_bonus": 0,
     "key_interactions": 4,
     "non_verified_interactions": 2,
     "rules_risk_score": 12,
     "tie_hash": "cd60df21f8646f82dd06659358a20f3e7649d59f3ec546baf900a98dfd3ad93b"
    }
   },
   "slug": "ashnod-the-uncaring"
  },
  {
   "memberships": [
    "exception",
    "low_commander_dependence",
    "rules_sensitive"
   ],
   "review_id": "human-sample-v1:bjorna-nightfall-alchemist-cecily",
   "review_requirement": {
    "allowed_methods": [
     "human",
     "agent_judgment"
    ],
    "requires_commander_first_context": true,
    "requires_evidence_classes": [
     "fact",
     "test_result",
     "strategic_judgment"
    ],
    "result_record": null,
    "script_may_author": false,
    "status": "pending"
   },
   "selection_inputs": {
    "exception": {
     "exception_count": 3,
     "project_authorization_status": "authorized_exceptions",
     "tie_hash": "e3a19200ef8506b5c40bac8f089c3f1938758eeb46f73505e5fdbb1d74f85e19"
    },
    "low_commander_dependence": {
     "commander_linked_combo_fraction": 0.333333,
     "explicit_commander_win_fraction": 0.25,
     "role": "supporting",
     "role_rank": 0,
     "tie_hash": "785d890b278f461edfb0cb19195f4cdbdc35aac4bd3083e1ed2294ef20cd1d49"
    },
    "rules_sensitive": {
     "construction_rule_count": 2,
     "exception_pending_bonus": 2,
     "key_interactions": 5,
     "non_verified_interactions": 3,
     "rules_risk_score": 18,
     "tie_hash": "10a55827beaca883c87ed0c2fc5eb04f381dd22e1b7b9d0904d28be8b3eeaf2a"
    }
   },
   "slug": "bjorna-nightfall-alchemist-cecily"
  },
  {
   "memberships": [
    "cedh"
   ],
   "review_id": "human-sample-v1:cormela-glamour-thief",
   "review_requirement": {
    "allowed_methods": [
     "human",
     "agent_judgment"
    ],
    "requires_commander_first_context": true,
    "requires_evidence_classes": [
     "fact",
     "test_result",
     "strategic_judgment"
    ],
    "result_record": null,
    "script_may_author": false,
    "status": "pending"
   },
   "selection_inputs": {
    "cedh": {
     "ceiling": 5,
     "ceiling_source": "grok_estimated_ceiling",
     "tie_hash": "58ff2193d3b8695bc69858209b8fa56ee1a5f95271b9907646d1af6ac62a6391"
    }
   },
   "slug": "cormela-glamour-thief"
  },
  {
   "memberships": [
    "random"
   ],
   "review_id": "human-sample-v1:doctor-doom-king-of-latveria",
   "review_requirement": {
    "allowed_methods": [
     "human",
     "agent_judgment"
    ],
    "requires_commander_first_context": true,
    "requires_evidence_classes": [
     "fact",
     "test_result",
     "strategic_judgment"
    ],
    "result_record": null,
    "script_may_author": false,
    "status": "pending"
   },
   "selection_inputs": {
    "random": {
     "tie_hash": "140e1f65506d34341c26959fa410d46278d2d30fec209aa703b78803d30c4d84"
    }
   },
   "slug": "doctor-doom-king-of-latveria"
  },
  {
   "memberships": [
    "anomaly"
   ],
   "review_id": "human-sample-v1:dr-eggman",
   "review_requirement": {
    "allowed_methods": [
     "human",
     "agent_judgment"
    ],
    "requires_commander_first_context": true,
    "requires_evidence_classes": [
     "fact",
     "test_result",
     "strategic_judgment"
    ],
    "result_record": null,
    "script_may_author": false,
    "status": "pending"
   },
   "selection_inputs": {
    "anomaly": {
     "anomaly_count": 16,
     "tie_hash": "18aa4ec8e9308a2f5a91a10578b9272b0d34afd8492087f1b9e489099b8cc9d6"
    }
   },
   "slug": "dr-eggman"
  },
  {
   "memberships": [
    "anomaly"
   ],
   "review_id": "human-sample-v1:edea-possessed-sorceress",
   "review_requirement": {
    "allowed_methods": [
     "human",
     "agent_judgment"
    ],
    "requires_commander_first_context": true,
    "requires_evidence_classes": [
     "fact",
     "test_result",
     "strategic_judgment"
    ],
    "result_record": null,
    "script_may_author": false,
    "status": "pending"
   },
   "selection_inputs": {
    "anomaly": {
     "anomaly_count": 17,
     "tie_hash": "57bdb025f67dfdf078babc976c5cec6942b5f6b050b71fbbe52605a19b098ccf"
    }
   },
   "slug": "edea-possessed-sorceress"
  },
  {
   "memberships": [
    "random"
   ],
   "review_id": "human-sample-v1:edward-kenway",
   "review_requirement": {
    "allowed_methods": [
     "human",
     "agent_judgment"
    ],